{
  "$schema": "https://json-schema.org/draft/2020-12/schema",
  "$id": "https://project-handoff.local/context.schema.json",
  "title": "Project Handoff semantic context 1.x",
  "type": "object",
  "required": [
    "schema_version",
    "coverage",
    "intent",
    "constraints",
    "authorization",
    "project",
    "instructions",
    "architecture",
    "work_items",
    "in_progress",
    "decisions",
    "working_copy",
    "validation",
    "environment",
    "external_state",
    "assets",
    "collaboration",
    "next_actions",
    "gaps"
  ],
  "$defs": {
    "fact": {
      "type": "object",
      "required": [
        "id",
        "statement",
        "source",
        "observed_at",
        "confidence"
      ],
      "properties": {
        "id": {
          "type": "string",
          "minLength": 1
        },
        "statement": {
          "type": "string",
          "minLength": 1
        },
        "source": {
          "type": "object",
          "required": [
            "kind",
            "ref"
          ],
          "properties": {
            "kind": {
              "enum": [
                "user_message",
                "file",
                "tool_result",
                "external_reference",
                "agent_assessment",
                "draft_template"
              ]
            },
            "ref": {
              "type": "string",
              "minLength": 1
            }
          }
        },
        "observed_at": {
          "type": "string",
          "minLength": 1
        },
        "confidence": {
          "enum": [
            "high",
            "medium",
            "low",
            "unknown"
          ]
        },
        "evidence_ids": {
          "type": "array",
          "items": {
            "type": "string"
          }
        },
        "superseded_by": {
          "type": [
            "string",
            "null"
          ]
        }
      }
    }
  },
  "properties": {
    "schema_version": {
      "type": "string",
      "pattern": "^1\\.[0-9]+\\.[0-9]+$"
    },
    "observed_fingerprint": {
      "type": [
        "string",
        "null"
      ]
    },
    "coverage": {
      "type": "object",
      "required": [
        "intent",
        "constraints",
        "authorization",
        "project",
        "instructions",
        "architecture",
        "work_items",
        "in_progress",
        "decisions",
        "working_copy",
        "validation",
        "environment",
        "external_state",
        "assets",
        "collaboration",
        "next_actions",
        "gaps"
      ],
      "properties": {
        "intent": {
          "type": "object",
          "required": [
            "status",
            "reason"
          ],
          "properties": {
            "status": {
              "enum": [
                "complete",
                "partial",
                "unknown",
                "not_applicable"
              ]
            },
            "reason": {
              "type": "string",
              "minLength": 1
            }
          }
        },
        "constraints": {
          "type": "object",
          "required": [
            "status",
            "reason"
          ],
          "properties": {
            "status": {
              "enum": [
                "complete",
                "partial",
                "unknown",
                "not_applicable"
              ]
            },
            "reason": {
              "type": "string",
              "minLength": 1
            }
          }
        },
        "authorization": {
          "type": "object",
          "required": [
            "status",
            "reason"
          ],
          "properties": {
            "status": {
              "enum": [
                "complete",
                "partial",
                "unknown",
                "not_applicable"
              ]
            },
            "reason": {
              "type": "string",
              "minLength": 1
            }
          }
        },
        "project": {
          "type": "object",
          "required": [
            "status",
            "reason"
          ],
          "properties": {
            "status": {
              "enum": [
                "complete",
                "partial",
                "unknown",
                "not_applicable"
              ]
            },
            "reason": {
              "type": "string",
              "minLength": 1
            }
          }
        },
        "instructions": {
          "type": "object",
          "required": [
            "status",
            "reason"
          ],
          "properties": {
            "status": {
              "enum": [
                "complete",
                "partial",
                "unknown",
                "not_applicable"
              ]
            },
            "reason": {
              "type": "string",
              "minLength": 1
            }
          }
        },
        "architecture": {
          "type": "object",
          "required": [
            "status",
            "reason"
          ],
          "properties": {
            "status": {
              "enum": [
                "complete",
                "partial",
                "unknown",
                "not_applicable"
              ]
            },
            "reason": {
              "type": "string",
              "minLength": 1
            }
          }
        },
        "work_items": {
          "type": "object",
          "required": [
            "status",
            "reason"
          ],
          "properties": {
            "status": {
              "enum": [
                "complete",
                "partial",
                "unknown",
                "not_applicable"
              ]
            },
            "reason": {
              "type": "string",
              "minLength": 1
            }
          }
        },
        "in_progress": {
          "type": "object",
          "required": [
            "status",
            "reason"
          ],
          "properties": {
            "status": {
              "enum": [
                "complete",
                "partial",
                "unknown",
                "not_applicable"
              ]
            },
            "reason": {
              "type": "string",
              "minLength": 1
            }
          }
        },
        "decisions": {
          "type": "object",
          "required": [
            "status",
            "reason"
          ],
          "properties": {
            "status": {
              "enum": [
                "complete",
                "partial",
                "unknown",
                "not_applicable"
              ]
            },
            "reason": {
              "type": "string",
              "minLength": 1
            }
          }
        },
        "working_copy": {
          "type": "object",
          "required": [
            "status",
            "reason"
          ],
          "properties": {
            "status": {
              "enum": [
                "complete",
                "partial",
                "unknown",
                "not_applicable"
              ]
            },
            "reason": {
              "type": "string",
              "minLength": 1
            }
          }
        },
        "validation": {
          "type": "object",
          "required": [
            "status",
            "reason"
          ],
          "properties": {
            "status": {
              "enum": [
                "complete",
                "partial",
                "unknown",
                "not_applicable"
              ]
            },
            "reason": {
              "type": "string",
              "minLength": 1
            }
          }
        },
        "environment": {
          "type": "object",
          "required": [
            "status",
            "reason"
          ],
          "properties": {
            "status": {
              "enum": [
                "complete",
                "partial",
                "unknown",
                "not_applicable"
              ]
            },
            "reason": {
              "type": "string",
              "minLength": 1
            }
          }
        },
        "external_state": {
          "type": "object",
          "required": [
            "status",
            "reason"
          ],
          "properties": {
            "status": {
              "enum": [
                "complete",
                "partial",
                "unknown",
                "not_applicable"
              ]
            },
            "reason": {
              "type": "string",
              "minLength": 1
            }
          }
        },
        "assets": {
          "type": "object",
          "required": [
            "status",
            "reason"
          ],
          "properties": {
            "status": {
              "enum": [
                "complete",
                "partial",
                "unknown",
                "not_applicable"
              ]
            },
            "reason": {
              "type": "string",
              "minLength": 1
            }
          }
        },
        "collaboration": {
          "type": "object",
          "required": [
            "status",
            "reason"
          ],
          "properties": {
            "status": {
              "enum": [
                "complete",
                "partial",
                "unknown",
                "not_applicable"
              ]
            },
            "reason": {
              "type": "string",
              "minLength": 1
            }
          }
        },
        "next_actions": {
          "type": "object",
          "required": [
            "status",
            "reason"
          ],
          "properties": {
            "status": {
              "enum": [
                "complete",
                "partial",
                "unknown",
                "not_applicable"
              ]
            },
            "reason": {
              "type": "string",
              "minLength": 1
            }
          }
        },
        "gaps": {
          "type": "object",
          "required": [
            "status",
            "reason"
          ],
          "properties": {
            "status": {
              "enum": [
                "complete",
                "partial",
                "unknown",
                "not_applicable"
              ]
            },
            "reason": {
              "type": "string",
              "minLength": 1
            }
          }
        }
      }
    },
    "intent": {
      "allOf": [
        {
          "$ref": "#/$defs/fact"
        },
        {
          "type": "object",
          "required": [
            "original_goal",
            "current_goal",
            "acceptance",
            "scope",
            "non_goals",
            "corrections"
          ],
          "properties": {
            "original_goal": {
              "type": "string",
              "minLength": 1
            },
            "current_goal": {
              "type": "string",
              "minLength": 1
            },
            "acceptance": {
              "type": "array"
            },
            "scope": {
              "type": "array"
            },
            "non_goals": {
              "type": "array"
            },
            "corrections": {
              "type": "array"
            }
          }
        }
      ]
    },
    "constraints": {
      "type": "array",
      "items": {
        "$ref": "#/$defs/fact"
      }
    },
    "authorization": {
      "type": "array",
      "items": {
        "$ref": "#/$defs/fact"
      }
    },
    "project": {
      "type": "array",
      "items": {
        "$ref": "#/$defs/fact"
      }
    },
    "instructions": {
      "type": "array",
      "items": {
        "$ref": "#/$defs/fact"
      }
    },
    "architecture": {
      "type": "array",
      "items": {
        "$ref": "#/$defs/fact"
      }
    },
    "work_items": {
      "type": "array",
      "items": {
        "allOf": [
          {
            "$ref": "#/$defs/fact"
          },
          {
            "type": "object",
            "required": [
              "status",
              "acceptance",
              "done",
              "remaining",
              "files",
              "depends_on"
            ],
            "properties": {
              "status": {
                "enum": [
                  "pending",
                  "in_progress",
                  "blocked",
                  "implemented_unverified",
                  "verified",
                  "cancelled"
                ]
              },
              "acceptance": {
                "type": "array"
              },
              "done": {
                "type": "array"
              },
              "remaining": {
                "type": "array"
              },
              "files": {
                "type": "array"
              },
              "depends_on": {
                "type": "array"
              }
            }
          }
        ]
      }
    },
    "in_progress": {
      "type": "array",
      "items": {
        "$ref": "#/$defs/fact"
      }
    },
    "decisions": {
      "type": "array",
      "items": {
        "$ref": "#/$defs/fact"
      }
    },
    "working_copy": {
      "type": "array",
      "items": {
        "$ref": "#/$defs/fact"
      }
    },
    "validation": {
      "type": "array",
      "items": {
        "allOf": [
          {
            "$ref": "#/$defs/fact"
          },
          {
            "type": "object",
            "required": [
              "result",
              "freshness",
              "started_at",
              "ended_at",
              "exit_code",
              "log",
              "code_fingerprint",
              "environment",
              "command"
            ],
            "properties": {
              "result": {
                "enum": [
                  "passed",
                  "failed",
                  "not_run",
                  "interrupted",
                  "unknown"
                ]
              },
              "freshness": {
                "enum": [
                  "current",
                  "stale",
                  "unknown"
                ]
              },
              "started_at": {},
              "ended_at": {},
              "exit_code": {},
              "log": {},
              "code_fingerprint": {},
              "environment": {},
              "command": {
                "type": "object",
                "required": [
                  "argv",
                  "cwd_ref",
                  "env_names",
                  "purpose",
                  "side_effects"
                ],
                "properties": {
                  "argv": {
                    "type": "array",
                    "items": {
                      "type": "string"
                    }
                  },
                  "env_names": {
                    "type": "array"
                  },
                  "cwd_ref": {
                    "type": "string"
                  },
                  "purpose": {
                    "type": "string"
                  },
                  "side_effects": {
                    "type": "string"
                  }
                }
              }
            }
          }
        ]
      }
    },
    "environment": {
      "type": "array",
      "items": {
        "$ref": "#/$defs/fact"
      }
    },
    "external_state": {
      "type": "array",
      "items": {
        "$ref": "#/$defs/fact"
      }
    },
    "assets": {
      "type": "array",
      "items": {
        "$ref": "#/$defs/fact"
      }
    },
    "collaboration": {
      "type": "array",
      "items": {
        "$ref": "#/$defs/fact"
      }
    },
    "next_actions": {
      "type": "array",
      "items": {
        "allOf": [
          {
            "$ref": "#/$defs/fact"
          },
          {
            "type": "object",
            "required": [
              "task_id",
              "preconditions",
              "files",
              "action",
              "expected_result",
              "validation",
              "on_failure"
            ],
            "properties": {
              "task_id": {
                "type": "string"
              },
              "preconditions": {
                "type": "array"
              },
              "files": {
                "type": "array"
              },
              "action": {
                "type": "string",
                "minLength": 1
              },
              "expected_result": {
                "type": "string",
                "minLength": 1
              },
              "validation": {
                "type": "string",
                "minLength": 1
              },
              "on_failure": {
                "type": "string",
                "minLength": 1
              }
            }
          }
        ]
      }
    },
    "gaps": {
      "type": "array",
      "items": {
        "allOf": [
          {
            "$ref": "#/$defs/fact"
          },
          {
            "type": "object",
            "required": [
              "reason",
              "impact",
              "resolution"
            ],
            "properties": {
              "reason": {
                "type": "string",
                "minLength": 1
              },
              "impact": {
                "type": "string",
                "minLength": 1
              },
              "resolution": {
                "type": "string",
                "minLength": 1
              }
            }
          }
        ]
      }
    }
  }
}
